{
  "schema_version": "imu-batch.v1",
  "source_mode": "device",
  "device_id": "esp32-cam-example",
  "clock": {
    "boot_id": "boot-7f3a91c2",
    "uptime_ms": 3601250,
    "wall_clock_synced": true,
    "wall_time": "2026-10-19T01:00:06.100Z"
  },
  "batch_seq": 361,
  "sensor": "mpu6050",
  "sample_rate_hz": 100,
  "accel_range_g": 8,
  "gyro_range_dps": 1000,
  "units": {
    "time": "ms_since_boot",
    "accel": "g",
    "gyro": "deg_per_s"
  },
  "samples": {
    "uptime_ms": [
      3601000,
      3601010,
      3601020,
      3601030,
      3601040,
      3601050,
      3601060,
      3601070,
      3601080,
      3601090,
      3601100,
      3601110,
      3601120,
      3601130,
      3601140,
      3601150,
      3601160,
      3601170,
      3601180,
      3601190
    ],
    "ax": [
      0.01,
      0.0184,
      0.0191,
      0.0114,
      0.0024,
      0.0004,
      0.0072,
      0.0166,
      0.0199,
      0.0141,
      0.0046,
      0.0,
      0.0046,
      0.0142,
      0.0199,
      0.0165,
      0.0071,
      0.0004,
      0.0025,
      0.0115
    ],
    "ay": [
      0.02,
      0.0116,
      0.0109,
      0.0186,
      0.0276,
      0.0296,
      0.0228,
      0.0134,
      0.0101,
      0.0159,
      0.0254,
      0.03,
      0.0254,
      0.0158,
      0.0101,
      0.0135,
      0.0229,
      0.0296,
      0.0275,
      0.0185
    ],
    "az": [
      0.985,
      0.9827,
      0.9779,
      0.9751,
      0.9767,
      0.9814,
      0.9848,
      0.9838,
      0.9793,
      0.9754,
      0.9758,
      0.98,
      0.9842,
      0.9845,
      0.9807,
      0.9762,
      0.9752,
      0.9786,
      0.9833,
      0.9849
    ],
    "gx": [
      0.5,
      0.668,
      0.682,
      0.528,
      0.349,
      0.308,
      0.444,
      0.631,
      0.698,
      0.582,
      0.391,
      0.3,
      0.393,
      0.584,
      0.698,
      0.63,
      0.442,
      0.308,
      0.35,
      0.53
    ],
    "gy": [
      0.4,
      0.232,
      0.218,
      0.372,
      0.551,
      0.592,
      0.456,
      0.269,
      0.202,
      0.318,
      0.509,
      0.6,
      0.507,
      0.316,
      0.202,
      0.27,
      0.458,
      0.592,
      0.55,
      0.37
    ],
    "gz": [
      0.4,
      0.354,
      0.258,
      0.201,
      0.235,
      0.328,
      0.396,
      0.375,
      0.285,
      0.209,
      0.216,
      0.3,
      0.384,
      0.391,
      0.314,
      0.224,
      0.204,
      0.272,
      0.366,
      0.399
    ]
  }
}
